{"accounting_consequences":{"cash_delta":"-51240.15","journal_entry_id":"jrn.7f1a","position_after":"100","realized_pnl":"0.00"},"created_at":"2026-09-04T14:30:05Z","executions":[{"executed_at":"2026-09-04T14:30:00Z","execution_id":"exec.001","fee":"0.15","price":"512.40","quantity":"100","venue":"venue.nasdaq"}],"instrument_id":"inst.us_equity.spy","intent_id":"intent.001","order_id":"ord.9b41","passport_id":"passport.ord.9b41","passport_schema_version":1,"risk_evaluation":{"approved":true,"evaluated_limits":["gross_exposure","daily_loss_limit"],"headroom_remaining_bps":4500,"policy_version":"pol.risk.v1"},"routing_plan":{"algorithm":"twap-v1","allocated_slices_count":3,"capability_version":"cap.nasdaq.v1","primary_venue":"venue.nasdaq"},"signal_attribution":{"model_event_id":"evt.sig.001","opportunity_description":"Volume-weighted 20-day breakout continuation","signal_power_bps":8500,"strategy_version":"strat.trend.v1"}}
